{"schema_version": 1, "jurisdiction": "us-ca", "generated": "2026-10-30", "counties": [
 {"county_fips": "06999", "name": "Sample", "seat": "Sample City", "agencies": [
  {"agency_id": "ca-sample-county-sheriff", "name": "Sample County Sheriff", "kind": "sheriff", "jurisdiction_name": "Sample County", "place_fips": null, "records_url": null, "records_email": null, "portal": {"vendor": "unknown", "url": null}, "flock_transparency_slug": null, "muckrock_agency_id": null, "verified": false, "sources": [{"title": "synthetic fixture", "url": null, "accessed": "2026-10-30"}]},
  {"agency_id": "ca-sample-city-police", "name": "Sample City Police", "kind": "police", "jurisdiction_name": "City of Sample City", "place_fips": "0699999", "records_url": null, "records_email": null, "portal": {"vendor": "unknown", "url": null}, "flock_transparency_slug": null, "muckrock_agency_id": null, "verified": false, "sources": [{"title": "synthetic fixture", "url": null, "accessed": "2026-10-30"}]},
  {"agency_id": "ca-sample-city-council", "name": "Sample City Council", "kind": "city_council", "jurisdiction_name": "City of Sample City", "place_fips": "0699999", "records_url": null, "records_email": null, "portal": {"vendor": "unknown", "url": null}, "flock_transparency_slug": null, "muckrock_agency_id": null, "verified": false, "sources": [{"title": "synthetic fixture", "url": null, "accessed": "2026-10-30"}]},
  {"agency_id": "ca-chp-sample-area", "name": "California Highway Patrol - Sample Area", "kind": "chp", "jurisdiction_name": "Sample County", "place_fips": null, "records_url": null, "records_email": null, "portal": {"vendor": "unknown", "url": null}, "flock_transparency_slug": null, "muckrock_agency_id": null, "verified": false, "sources": [{"title": "synthetic fixture", "url": null, "accessed": "2026-10-30"}]}]}]}
